"%s already exist","%s มีอยู่แล้ว"
"Website code should contain only letters (a-z), numbers (0-9) or underscore(_), first character should be a letter","โค้ดเว็บไซต์จะต้องเป็นตัวอักษร (a-z), ตัวเลข (0-9) หรือขีดล่าง(_), เท่านั้นและตัวแรกจะต้องเป็นตัวอักษร"
"Website doesn't exist","Website doesn't exist"
"Website was successfully deleted.","ลบเว็บไซต์แล้ว."
"Website was successfully saved","บันทึกเว็บไซต์แล้ว"
"Website with the same code","เว็บไซต์ที่มีโค้ดเหมือนกัน"
"Weekend Days","วันสุดสัปดาห์"
"Welcome Text","ข้อความต้อนรับ"
"Wrong number of arguments for %s","หมายเลข argumentไม่ถูกต้องสำหรับ %s"
"Yes","ใช่"
"Your design change for the specified store intersects with another one, please specify another date range","Your design change for the specified store intersects with another one, please specify another date range"
"Your order can not be completed at this time as there is no payment methods available for it.","ไม่สามารถทำคำสั่งซื้อของคุณเสร็จสิ้นในเวลานี้เหมื่อนไม่มีวิธีการชำระเงินที่เหมาะสำหรับมัน."
"Your order can not be completed at this time as there is no shipping methods available for it. Please make neccessary changes in your shipping address.","ไม่สามารถทำคำสั่งซื้อของคุณเสร็จสิ้นในเวลานี้เหมื่อนไม่มีวิธการีส่งสินค้าที่เหมาะสำหรับมัน. กรุณาเปลื่ยน neccessary ในที่อยู่ในการส่งสินค้าของคุณ."
"Your session has been expired, you will be relogged in now.","ระยะเวลาเข้าสู่ระบบของคุณหมดเวลาลงแล้ว กรุณาเข้าสู่ระบบใหม่อีกครั้ง."
