"%s already exist","%s มีอยู่แล้ว"
"%s already exists","%s มีอยู่แล้ว"
"-- Please Select --","-- กรุณาเลือก --"
"Add Block Names to Hints","เพิ่มชื่อ Block เพื่อแนะนำ"
"Add Secret Key to URLs","เพิ่มคีย์ลับ ไปยัง URLs"
"Add Store Code to Urls","เพิ่มรหัสร้านค้าไปที่ Urls"
"Admin","ผู้ดูแลระบบ"
"Admin Base URL","พื้นฐาน ผู้ดูแลระบบ URL"
"Admin User Emails","ผู้ดูแลระบบ อีเมลล์ผู้ใช้"
"Advanced","ขั้นสูง"
"Allow countries","ประเทศที่อนุญาต"
"Allowed IPs (comma separated)","IP ที่อนุญาต (แยกด้วยจุลภาค)"
"Are you sure?","คุณแน่ใจ?"
"Back","กลับ"
"Backup options","Backup options"
"Base JavaScript URL","Base JavaScript URL"
"Base Link URL","Base Link URL"
"Base Media URL","Base Media URL"
"Base Skin URL","Base Skin URL"
"Base URL","Base URL"
"Before modifying the store view code please make sure that it is not used in index.php","ก่อนการแก้ไข code ร้านค้ากรุณาดู ให้แน่ใจว่ามันไม่ถูกใช้อยู่ใน index.php"
"Before modifying the website code please make sure that it is not used in index.php","ก่อนการแก้ไข code เว็บไซต์กรุณาดู ให้แน่ใจ มันไม่ถูกใช้อยู่ใน index.php"
"Block with name ""%s"" already exists","บล็อคชื่อ ""%s"" มีอยู่แล้ว"
"Blocks HTML output","Blocks HTML output"
"Browser Capabilities Detection","ขีดความสามารถของเบราว์เซอร์ที่่ตรวจจับ"
"Can't retrieve request object","ไม่สามารถคืนความต้องการของ object"
"Can\'t retrieve entity config: %s","ไม่สามารถเรียกคืน entity config: %s"
"Cancel","ยกเลิก"
"Cannot Delete Email Template","ไม่สามารถลบเทมเพลตอีเมล์ได้"
"Cannot complete this operation from non-admin area.","ไม่สามารถดำเนินการจากพื้นที่ที่ไม่ใช่ผู้ดูแลระบบ."
"Card type doesn\'t match credit card number","ประเภทบัตรไม่ีตรงกับหมายเลขบัตรเครดิต"
"Category object is required for determining product request path","Category object is required for determining product request path"
"Code","รหัส"
"Collections Data","เก็บรวบรวมข้อมูล"
"Configuration","การกำหนดค่า"
"Controller file was loaded but class does not exist","ไฟล์ ควบคุม ถูกโหลดแล้วแต่ไม่มีคลาส"
"Cookie Domain","Cookie Domain"
"Cookie Lifetime","ระยะเวลาของ Cookie"
"Cookie Path","Cookie Path"
"Copyright","ลิขสิทธิ์"
"Countries options","ตัวเลือกประเทศ"
"Create Store","สร้างร้านค้า"
"Create Store View","สร้างมุมมองร้าน"
"Create Website","สร้างเว็บไซต์"
"Credit card number doesn\'t match credit card type","ประเภทบัตรไม่ีตรงกับหมายเลขบัตรเครดิต"
"Current package name","ชื่อแพ็คเกจปัจจุบัน"
"Custom Design","ดีไซน์เอง"
"Custom admin URL","ปรับปรุง admin URL"
"Custom email 1","ปรับปรุง email 1"
"Custom email 2","ปรับปรุง email 2"
"Customer support","บริการลูกค้า"
"Date From","ตั้งแต่วันที่"
"Date To","ถึงวันที่"
"Date/time format ""%s"" is not supported.","รูปแบบ วันที่/เวลา ""%s"" ไม่สนับสนุน"
"Debug","Debug"
"Default","ค่าเริ่มต้น"
"Default Description","คำอธิบายที่ตั้งไว้เป็นค่าเริ่มต้น"
"Default Keywords","ค่าเริ่มต้นของคำหลัก"
"Default Pages","หน้าเริ่มต้น"
"Default Robots","Default Robots"
"Default Store","ร้านค้าเริ่มต้น"
"Default Store View","มุมมองร้านค้าเริ่มต้น"
"Default Title","Default Title"
"Default country","ประเทศเริ่มต้น"
"Default no-route url","ค่าเริ่มต้นไม่กำหนด Url"
"Default web url","URL เว็บเริ่มต้น"
"Delete","ลบ"
"Delete Store","ลบร้านค้า"
"Delete Store View","ลบมุมมองร้าน"
"Delete Website","ลบเว็บไซต์"
"Deleting a %1$s will not delete the information associated with the %1$s (e.g. categories, products, etc.), but the %1$s will not be able to be restored. It is suggested that you create a database backup before deleting the %1$s.","Deleting a %1$s will not delete the information associated with the %1$s (e.g. categories, products, etc.), but the %1$s will not be able to be restored. It is suggested that you create a database backup before deleting the %1$s."
"Design","ดีไซน์"
"Design Change","เปลี่ยนแปลงดีไซน์"
"Developer","ผู้พัฒนา"
"Developer Client Restrictions","ข้อกำหนดส่วน Client ของผู้พัฒนา"
"Disable email communications","ปิดการใช้งานอีเมล์"
"Disable modules output","ปิดการใช้งานโมดูลผลลัพธ์"
"Display demo store notice","แจ้งการแสดงร้านค้าตัวอย่างให้ทราบล่วงหน้า"
"Duplicate Of Template Code","การซ้ำกันของโค้ดเทมเพลต"
"Edit Design Change","แก้ไขการเปลี่ยนแปลงดีไซน์"
"Edit Store","แก้ไขร้านค้า"
"Edit Store View","แก้ไขมุมมองร้านค้า"
"Edit Website","แก้ไขเว็บไซต์"
"Empty identifier field name","ทำชื่อฟิลด์ Identifier ให้ว่าง"
"Empty main table name","ทำชื่อตารางหลักให้ว่าง"
"Enable Prototype Deprecation Log","Enable Prototype Deprecation Log"
"Enabled","เปิดการใชงาน"
"Enabled for Admin","Enabled for Admin"
"Enabled for Frontend","เปิดการใช้งานสำหรับส่วนหน้า"
"Error in file: ""%s"" - %s","ผิดพลาดในไฟล์: ""%s"" - %s"
"Error while saving. Please try again later.","พบข้อผิดพลาดขณะบันทึกข้อมูล กรุณาลองใหม่อีกครั้ง"
"Error: Passwords do not match","Error: รหัสผ่านไม่ตรงกัน"
"Exceptions Log File Name","การยกเว้นชื่อ Log ไฟล์"
"First Day of Week","First Day of Week"
"Footer","Footer"
"Forgot Password Email Sender","ลืมรหัสผ่านส่งอีเมลล์ผู้ส่ง"
"Forgot Password Email Template","ลืมรหัสผ่านส่งอีเมลล์เทมเพลต"
"General","ทั่วไป"
"General Settings","การตั้งค่าทั่วไป"
"General contact","ติดต่อทั่วไป"
"Global","โดยรวม"
"HTML Head","HTML Head"
"Header","Header"
"Host","โฮสต์"
"Id path for specified store","Id path สำหรับร้านค้าที่เลือก"
"Incorrect credit card expiration date","ไม่ถูกต้องบัตรเครดิตหมดอายุ"
"Invalid base url type","ประเภท Urlพื้นฐานไม่ถูกต้อง"
"Invalid block name to set child %s: %s","ชื่อ Block ไม่ถูกต้องในการตั้งค่า Child %s: %s"
"Invalid block type: %s","ประเภท block ไม่ถูกต้อง: %s"
"Invalid block: %s","block ไม่ถูกต้อง: %s"
"Invalid layout update argument, expected Mage_Core_Model_Layout_Element","Invalid layout update argument, expected Mage_Core_Model_Layout_Element"
"Invalid layout update handle","การจัดการอัพเดท layout ไม่ถูกต้อง"
"Invalid messages storage ""%s"" for layout messages initialization","Invalid messages storage ""%s"" for layout messages initialization"
"Invalid transactional email code: ","ไม่ถูต้องเกี่ยวกับการติดต่อโค๊ดอีเมลล์: "
"Invalid websites configuration path: %s","การตั้งค่า path เว็บไซต์ไม่ถูกต้อง: %s"
"JavaScript Settings","การตั้งค่าจาวาสคริปต์"
"Layout","เลย์เอาท์"
"Layouts","Layouts"
"Leave empty for access from any location","ปล่อยว่างสำหรับการเข้าถึงจากตำแหน่งใดๆ"
"Locale","สถานที่"
"Locale options","ตัวเลือกสถานที่"
"Log Settings","Log Settings"
"Logging from Mage::log(). File is located in {{base_dir}}/var/log","Logging from Mage::log(). File is located in {{base_dir}}/var/log"
"Logging from Mage::logException(). File is located in {{base_dir}}/var/log","Logging from Mage::logException(). File is located in {{base_dir}}/var/log"
"Logo Image Alt","Logo Image Alt"
"Logo Image Src","Logo Image Src"
"Manage Stores","Manage Storesจัดการร้านค้า"
"Match expressions in the same order as displayed in the configuration.","expresions ที่ตรงกันในบางออเดอร์ที่แสดงในการตั้งค่า."
"Maximum length exceeded.","เกินความยาวสูงสุด."
"Merge JavaScript Files","ผสานไฟล์ JavaScript "
"Miscellaneous HTML","Miscellaneous HTML"
"Miscellaneous scripts","Miscellaneous scripts"
"Model class does not exist: %s","ไม่มีคลาสโมเดล: %s"
"Model collection resource name is not defined","ไม่ได้ระบุชื่อ Resource ของคอลเลคชั่นโมเดล"
"Module ""%1$s"" can not be depended from ""%2$s""","Module ""%1$s"" can not be depended from ""%2$s"""
"Module ""%1$s"" requires module ""%2$s""","Module ""%1$s"" requires module ""%2$s"""
"Name","ชื่อ"
"New Design Change","การเปลี่ยนแปลงดีไซน์ใหม่"
"New Store","ร้านค้าใหม่"
"New Store View","มุมมองร้านค้าใหม่"
"New Website","เว็บไซต์ใหม่"
"No","ไม่"
"Package","แพ็คเกจ"
"Please choose to register or to checkout as a guest","กรุณาเลือกลงทะเบียนหรือแจ้งออกในกรณีเป็นผู้เยี่ยมชม"
"Please define flag code.","Please define flag code."
"Please enter 6 or more characters.","กรุณาใส่ตัวอักษรตั้งแต่ 6 ตัวขึ้นไป."
"Please enter 6 or more characters. Leading or trailing spaces will be ignored.","กรุณาใส่ตัวอักษรตั้งแต่ 6 ตัวขึ้นไป หากมีเว้นวรรคข้างหน้าและหลังจะไม่ถูกนับ"
"Please enter a number greater than 0 in this field.","กรุณาใส่ตัวเลขที่ค่ามากกว่า 0 ในฟิลด์นี้"
"Please enter a valid $ amount. For example $100.00.","กรุณาใส่จำนวนเงิน $ ที่ถูกต้อง ตัวอย่างเช่น $100.00"
"Please enter a valid URL. For example http://www.example.com or www.example.com","กรุณาใส่ URL ที่ถูกต้อง ตัวอย่างเช่น http://www.example.com หรือ www.example.com"
"Please enter a valid URL. http:// is required","กรุณาใส่ URL ที่ถูกต้อง ต้องมี http:// "
"Please enter a valid credit card number.","กรุณาใส่เลขบัตรเครดิตที่ถูกต้อง."
"Please enter a valid credit card verification number.","โปรดยืนยันหมายเลขบัตรเครดิตที่ถูกต้อง."
"Please enter a valid date.","กรุณาใส่วันที่ที่ถูกต้อง."
"Please enter a valid email address. For example johndoe@domain.com.","กรุณาใส่อีเมล์ที่ถูกต้อง ตัวอย่างเช่น johndoe@domain.com."
"Please enter a valid number in this field.","กรุณาใส่ตัวเลขที่ถูกต้องในฟิลด์นี้"
"Please enter a valid phone number. For example (123) 456-7890 or 123-456-7890.","กรุณาใส่หมายเลขโทรศัพท์ที่ถูกต้อง ตัวอย่างเช่น (123) 456-7890 หรือ 123-456-7890"
"Please enter a valid social security number. For example 123-45-6789.","กรุณาใส่หมายเลขประกันสังคมที่ถูกต้อง ตัวอย่างเช่น 123-45-6789"
"Please enter a valid zip code.","กรุณาใส่รหัสไปรษณีย์ที่ถูกต้อง"
"Please enter a valid zip code. For example 90602 or 90602-1234.","กรุณาใส่รหัสไปรษณีย์ที่ถูกต้อง ตัวอย่างเช่น 90602 หรือ 90602-1234"
"Please enter valid password.","กรุณาใส่รหัสผ่านที่ถูกต้อง."
"Please input a valid CSS-length. For example 100px or 77pt or 20em or .5ex or 50%","Please input a valid CSS-length. For example 100px or 77pt or 20em or .5ex or 50%"
"Please make sure that Base URL ends with '/' (slash), e.g. http://yourdomain/magento/","Please make sure that Base URL ends with '/' (slash), e.g. http://yourdomain/magento/"
"Please make sure your passwords match.","โปรดตรวจสอบให้แน่ใจว่ารหัสผ่านของคุณตรงกัน."
"Please select State/Province.","กรุณาเลือก รัฐ/จังหวัด"
"Please select an option.","กรุณาเลือกตัวเลือก."
"Please select one of the above options.","กรุณาเลือกตัวเลือกใดตัวเลือกหนึ่งด้านบน"
"Please select one of the options.","กรุณาเลือกตัวเลือกใดตัวเลือกหนึ่ง"
"Please specify payment method.","กรุณาระบุวิธีชำระเงิน."
"Please specify shipping method.","กรุณาระบุวิธีส่งสินค้า."
"Please use letters only (a-z or A-Z) in this field.","กรุณาใช้เฉพาะตัวอักษร (a-z or A-Z)ในฟิลด์นี้."
"Please use letters only (a-z) in this field.","Please use letters only (a-z) in this field."
"Please use numbers only in this field. please avoid spaces or other characters such as dots or commas.","กรุณาใช้เฉพาะตัวเลขในฟิลด์นี้และยกเว้นการเว้นวรรคหรือตัวอักษรอื่นเช่นจุด หรือจุลภาค."
"Please use only letters (a-z or A-Z), numbers (0-9) or underscore(_) in this field, first character should be a letter.","โปรดใช้ตัวอักษร (AZ หรือ az), ตัวเลข (0-9) หรือขีดเส้นใต้ (_) ในฟิลด์นี้, ตัวแรกควรเป็นอักขระตัวอักษร."
"Please use only letters (a-z) or numbers (0-9) only in this field. No spaces or other characters are allowed.","กรุณาใช้เฉพาะตัวอักษร (a-z) หรือตัวเลข (0-9) ในฟิลด์นี้ ห้ามมีเว้นวรรคหรือตัวอักษรอื่น ๆ."
"Please use only letters (a-z) or numbers (0-9) or spaces and # only in this field.","กรุณาใช้เฉพาะตัวอักษร (a-z) หรือตัวเลข (0-9) หรือเว้นวรรคและ # ในฟิลด์นี้"
"Please use only letters (a-z), numbers (0-9) or underscore(_) in this field, first character should be a letter.","กรุณาใช้เฉพาะตัวอักษร (a-z), ตัวเลข (0-9) หรือขีดล่าง (_) ในฟิลด์นี้ โดยตัวแรกสุดจะต้องเป็นตัวอักษร"
"Please use this date format: dd/mm/yyyy. For example 17/03/2006 for the 17th of March, 2006.","กรุณาใช้รูปแบบวันที่นี้: dd/mm/yyyy ตัวอย่างเช่น 17/03/2006 สำหรับวันที่ 17 มีนาคม 2006"
"Please wait, loading...","กำลังโหลด โปรดรอสักครู่..."
"Polls","โพล"
"Port (25)","Port (25)"
"Profiler","Profiler"
"Request path for specified store","ขอ Path สำหรับร้านค้าที่กำหนด"
"Requested invalid store ""%s""","ความต้องการร้านค้าไม่ถูกต้อง ""%s"""
"Resource is not set","ยังไม่ได้ตั้งค่า Resource"
"Root Category","Root Category"
"SMTP settings (Windows server only)","การตั้งค่า SMTP (เฉพาะเซิร์ฟเวอร์แบบ Windows เท่านั้น)"
"Sales representative","ตัวแทนขาย"
"Save","บันทึก"
"Save Store","บันทึกร้านค้า"
"Save Store View","บันทึกมุมมองร้าน"
"Save Website","บันทึกเว็บไซต์"
"Search Engines Optimization","การปรับแต่งเครื่องมือในการค้นหา"
"Secure","ปลอดภัย"
"Security","ความปลอดภัย"
"Select Date","Select Date"
"Sender email","อีเมลล์ผู้ส่ง"
"Sender name","ชื่อผู้ส่ง"
"Services","การบริการ"
"Session Cookie management","Session Cookie management"
"Session Lifetime (seconds)","ระยะเวลาเซสชัน, วินาที"
"Session Validation Settings","Session Validation Settings"
"Set as default","ตั้้งค่าเริ่มต้น"
"Skin (Images / CSS)","สกิน (รูปภาพ / CSS)"
"Sort order","การจัดเรียง"
"Specified date/time ""%1$s"" do not match format ""%2$s"".","ระบุ วัน/เวลา ""%1$s"" รูปแบบไม่ตรงกัน ""%2$s""."
"Specify either category or product, or both.","Specify either category or product, or both."
"Start date can\'t be greater than end date","วันเริ่มต้นไม่ดีกว่าวันสิ้นสุด"
"Startup page","หน้าเริ่ม"
"Status","สถานะ"
"Store","ร้านค้า"
"Store Email Addresses","อีเมลล์ของร้าน"
"Store Information","ข้อมูลร้านค้า"
"Store Name","ชื่อร้านค้า"
"Store View","Store View"
"Store View Information","ข้อมูลมุมมองร้าน"
"Store View Name","ชื่อมุมมองร้าน"
"Store View was successfully saved","บันทึกมุมมองร้านค้าแล้ว"
"Store code should contain only letters (a-z), numbers (0-9) or underscore(_), first character should be a letter","โค้ดร้านค้าจะต้องเป็นตัวอักษร (a-z), ตัวเลข (0-9) หรือขีดล่าง(_), เท่านั้นและตัวแรกจะต้องเป็นตัวอักษร"
"Store doesn't exist","ไม่มีร้านค้าอยู่"
"Store view doesn't exist","Store view doesn't exist"
"Store view was successfully deleted.","Store view was successfully deleted."
"Store was successfully deleted.","ลบร้านค้าแล้ว."
"Store was successfully saved","บันทึกร้านค้าแล้ว."
"Store with the same code","ร้านค้าที่มีโค้ดเหมือนกัน"
"System","ระบบ"
"System Log File Name","System Log File Name"
"Template Path Hints","เทมเพลต Path Hints"
"Templates","เทมเพลต"
"The %s you entered is invalid. Please make sure that it follows ""http://domain.com/"" format.","The %s you entered is invalid. Please make sure that it follows ""http://domain.com/"" format."
"Themes","ธีม"
"This category and all its child elements","ประเภทนี้และส่วนประกอบย่อยทั้งหมดของมัน"
"This category and its child categories only","เฉพาะประเภทนี้และประเภทย่อยของมัน"
"This category and its products only","เฉพาะประเภทนี้และสินค้าของมัน"
"This category only","เฉพาะประเภทนี้เท่านั้น"
"This is a required field.","ฟิลด์นี้จำเป็น."
"This store cannot be deleted","ร้านค้านี้ไม่ได้ถูกลบ"
"This store cannot be deleted.","ร้านค่้านี้ไม่ได้ถูกลบ."
"This store view cannot be deleted","มุมมองร้านค้านี้ไม่สามารถลบออก"
"This store view cannot be deleted.","มุมมองร้านค้านี้ไม่สามารถลบออก."
"This website cannot be deleted","เว็บไซต์นี้ไม่ได้ถูกลบ"
"This website cannot be deleted.","เว็บไซต์นี้ไม่ได้ถูกลบ."
"This will be displayed just before body closing tag","This will be displayed just before body closing tag"
"This will be included before head closing tag in page HTML","This will be included before head closing tag in page HTML"
"Timezone","โซนเวลา"
"Title Prefix","Title Prefix"
"Title Suffix","Title Suffix"
"Translate Inline","Translate Inline"
"Translate cache should be disabled for both Frontend and Admin inline translations","Translate cache should be disabled for both Frontend and Admin inline translations"
"Translations","การเปลี่ยน"
"Unable to delete store view. Please, try again later.","ไม่สามารถลบมุมมองร้านค้า กรุณาลองใหม่อีกครั้ง."
"Unable to delete store. Please, try again later.","ไม่สามารถลบร้านค้าได้ กรุณาลองใหม่อีกครั้ง."
"Unable to delete website. Please, try again later.","ไม่สามารถลบเว็บไซต์ได้. กรุณาลองใหม่อีกครั้ง"
"Unable to proceed. Please, try again","ไม่สามารถดำเนินการต่อได้. กรุณาลองใหม่อีกครั้ง"
"Unknown scope ""%s""","ไม่รู้ขอบเขต ""%s"""
"Unsecure","ไม่ปลอดภัย"
"Url Options","ตัวเลือก Url "
"Use HTTP Only","ใช้  HTTP เท่านั้น"
"Use Secure URLs in Admin","Use Secure URLs in Admin"
"Use Secure URLs in Frontend","Use Secure URLs in Frontend"
"Use Web Server Rewrites","ใช้การเขียนเว็บเซิร์ฟเวอร์ใหม่"
"Use custom admin URL","ใช้การปรับปรุง URL ในส่วนผู้ดูแล"
"Validate HTTP_USER_AGENT","Validate HTTP_USER_AGENT"
"Validate HTTP_VIA","Validate HTTP_VIA"
"Validate HTTP_X_FORWARDED_FOR","Validate HTTP_X_FORWARDED_FOR"
"Validate REMOTE_ADDR","Validate REMOTE_ADDR"
"Values less than 60 are ignored.","ค่าน้อนกว่า 60 ไม่สนใจ."
"Web","เว็บ"
"Website","เว็บไซต์"
"Website Information","ข้อมูลเว็บไซต์"
"Website Name","ชื่อเว็บไซต์"
